{"kind":"upsert","record_id":"call:43","source_epoch":"8","record_revision":"1","cursor_started_at_epoch_ms":"1700000100000","cursor_provider_id":"43","captured_at_epoch_ms":"1700000100999","capture_revision":"10","policy_revision":"10","metadata":{"direction":"missed","started_at_epoch_ms":"1700000100000","ended_at_epoch_ms":"1700000100000","duration_seconds":"0","observed_at_epoch_ms":"1700000100999","number_presentation":"restricted"},"counterparty_number":{"state":"withheld"}}
