{"kind":"upsert","record_id":"call:42","source_epoch":"7","record_revision":"1","cursor_started_at_epoch_ms":"1700000000000","cursor_provider_id":"42","captured_at_epoch_ms":"1700000000999","capture_revision":"9","policy_revision":"9","metadata":{"direction":"incoming","started_at_epoch_ms":"1700000000000","ended_at_epoch_ms":"1700000060000","duration_seconds":"60","observed_at_epoch_ms":"1700000000999","number_presentation":"allowed"},"counterparty_number":{"state":"released","value":"+15551234567"}}
